{"format":"atlas-projection-pack-v1","immutable":true,"mappings":["allen","beryl","cosmos"],"pack_id":"ibl-atlas-projections-05b9f3f85db9","projections":[{"display_slices":[4,12,20,28,36,44,52,60,68,76,84,92,100,108,116,124,132,140,148,156,164,172,180,188,196,204,212,220,228,236,244,252,260,268,276,284,292,300,308,316,324,332,340,348,356,364,372,380,388,396,404,412,420,428,436,444,452,460,468,476,484,492,500,508,516,524,532,540,548,556,564,572,580,588,596,604,612,620,628,636,644,652,660,668,676,684,692,700,708,716,724,732,740,748,756,764,772,780,788,796,804,812,820,828,836,844,852,860,868,876,884,892,900,908,916,924,932,940,948,956,964,972,980,988,996,1004,1012,1020,1028,1036,1044,1052,1060,1068,1076,1084,1092,1100,1108,1116,1124,1132,1140,1148,1156,1164,1172,1180,1188,1196,1204,1212,1220,1228,1236,1244,1252,1260,1268,1276,1284,1292,1300,1308,1316],"grid_id":"allen-ccf-2017-10um","id":"coronal","kind":"registered-slice-stack","plane_index_to_world_um":[0,10,0,-5739,-10,0,0,5400,0,0,-10,332,0,0,0,1],"reference_space_id":"allen-ccf-2017","resource_index":{"format":"atlas-registered-svg-resource-index-v1","resource":{"bytes":1952,"codec":{"decoded_bytes":8437,"level":9,"name":"gzip"},"media_type":"application/json","path":"registered/coronal/resources.json.gz","sha256":"e4a22c46be9d7bcfbf8edc7981ceac563da777760f04ca1d2d4714ae53bd083b"}},"slice_count":1320,"slice_shape":[1140,800],"view_box":[-0.5,-0.5,1140,800],"voxel_edge_extent_um":[-5744.0,5656.0,-7795.0,5405.0,-7663.0,337.0],"world_slice_axis":"ap","world_to_plane_index":[0.0,-0.1,0.0,540.0,0.1,0.0,0.0,573.9,0.0,0.0,-0.1,33.2,0.0,0.0,0.0,1.0]},{"display_slices":[6,14,22,30,38,46,54,62,70,78,86,94,102,110,118,126,134,142,150,158,166,174,182,190,198,206,214,222,230,238,246,254,262,270,278,286,294,302,310,318,326,334,342,350,358,366,374,382,390,398,406,414,422,430,438,446,454,462,470,478,486,494,502,510,518,526,534,542,550,558,566,574,582,590,598,606,614,622,630,638,646,654,662,670,678,686,694,702,710,718,726,734,742,750,758,766,774,782,790,798,806,814,822,830,838,846,854,862,870,878,886,894,902,910,918,926,934,942,950,958,966,974,982,990,998,1006,1014,1022,1030,1038,1046,1054,1062,1070,1078,1086,1094,1102,1110,1118,1126,1134],"grid_id":"allen-ccf-2017-10um","id":"sagittal","kind":"registered-slice-stack","plane_index_to_world_um":[10,0,0,-5739,0,10,0,-7790,0,0,-10,332,0,0,0,1],"reference_space_id":"allen-ccf-2017","resource_index":{"format":"atlas-registered-svg-resource-index-v1","resource":{"bytes":1699,"codec":{"decoded_bytes":7263,"level":9,"name":"gzip"},"media_type":"application/json","path":"registered/sagittal/resources.json.gz","sha256":"a634a4aa9b9fff8699a275d231bcb229823d00cf0b7f23f1191ce1747b05be83"}},"slice_count":1140,"slice_shape":[1320,800],"view_box":[-0.5,-0.5,1320,800],"voxel_edge_extent_um":[-5744.0,5656.0,-7795.0,5405.0,-7663.0,337.0],"world_slice_axis":"ml","world_to_plane_index":[0.1,0.0,0.0,573.9,0.0,0.1,0.0,779.0,0.0,0.0,-0.1,33.2,0.0,0.0,0.0,1.0]},{"display_slices":[1,9,17,25,33,41,49,57,65,73,81,89,97,105,113,121,129,137,145,153,161,169,177,185,193,201,209,217,225,233,241,249,257,265,273,281,289,297,305,313,321,329,337,345,353,361,369,377,385,393,401,409,417,425,433,441,449,457,465,473,481,489,497,505,513,521,529,537,545,553,561,569,577,585,593,601,609,617,625,633,641,649,657,665,673,681,689,697,705,713,721,729,737,745,753,761,769,777,785,793],"grid_id":"allen-ccf-2017-10um","id":"horizontal","kind":"registered-slice-stack","plane_index_to_world_um":[0,10,0,-5739,0,0,-10,5400,-10,0,0,332,0,0,0,1],"reference_space_id":"allen-ccf-2017","resource_index":{"format":"atlas-registered-svg-resource-index-v1","resource":{"bytes":1307,"codec":{"decoded_bytes":5303,"level":9,"name":"gzip"},"media_type":"application/json","path":"registered/horizontal/resources.json.gz","sha256":"b2795ea5f9edcce22aa8790bfd957504dac6e12241fbf500cea02dbeb37c2d07"}},"slice_count":800,"slice_shape":[1140,1320],"view_box":[-0.5,-0.5,1140,1320],"voxel_edge_extent_um":[-5744.0,5656.0,-7795.0,5405.0,-7663.0,337.0],"world_slice_axis":"dv","world_to_plane_index":[0.0,0.0,-0.1,33.2,0.1,0.0,0.0,573.9,0.0,-0.1,0.0,540.0,0.0,0.0,0.0,1.0]},{"fragment":{"encoding":"utf-8","format":"ibl-regional-svg-fragment-v1","resource":{"bytes":14694,"codec":{"decoded_bytes":44741,"level":9,"name":"gzip"},"media_type":"image/svg+xml","path":"static/top.isvg.gz","sha256":"682006676b7d1caf19dd179d021a0226616148fe40eeebcd9a6953ef6f98af33"}},"id":"top","kind":"static-regional-map","path_count":114,"view_box":[60,20,340,300]},{"fragment":{"encoding":"utf-8","format":"ibl-regional-svg-fragment-v1","resource":{"bytes":66637,"codec":{"decoded_bytes":223637,"level":9,"name":"gzip"},"media_type":"image/svg+xml","path":"static/swanson.isvg.gz","sha256":"5275e6fece4b33d8993b749fc8b4dc4d39dc62ba5edd02f64fee4a2338ddfe96"}},"id":"swanson","kind":"static-regional-map","path_count":808,"view_box":[60,20,340,300]}],"provenance":{"builder":{"command":"python -m tools.projection_pack.build","commit":"62199f51d81a7833480c64559930cdec9993f702","environment":{"machine":"x86_64","numpy":"2.5.2","operating_system":"linux","python":"3.12.3"},"name":"ephys-atlas-projection-pack","repository":"rossant/ibl-ephys-atlas-web-v2","version":"1"},"notes":["Static maps are affine-free and carry no scientific navigation coordinates."],"recipe":{"created_at":"2026-09-08T13:09:12Z","grid_id":"allen-ccf-2017-10um","id":"atlas-projection-pack-v1","license_notice":{"format":"ibl-static-asset-license-v1","resource":{"bytes":2080,"codec":{"decoded_bytes":2080,"name":"none"},"media_type":"text/plain; charset=utf-8","path":"LICENSES/IBL-EPHYS-ATLAS-V1-STATIC-ASSETS-MIT.txt","sha256":"f31adf14af0265cae0f866a515bda9b0750f7473d40cef5598c7f4305037ce37"}},"registered_parent_manifest_sha256":"4aeab256be79588fb6b9032bb9482479e227a1fa5499060db037318882e5fe9d","registered_parent_pack_id":"allen-ccfv3-10um-bilateral-exact-599b5e0bbab1-display-80um-d8-f8277956e67a","static_projection_modes":{"swanson":"pinned-curated","top":"pinned-curated"},"static_source_mode":"pinned-curated"},"sources":[{"description":"Validated bilateral 10 um sparse registered anatomy pack","path":"registered-parent/manifest.json","role":"atlas-geometry","sha256":"4aeab256be79588fb6b9032bb9482479e227a1fa5499060db037318882e5fe9d"},{"description":"Pinned Allen/Beryl/Cosmos legacy-index crosswalk","path":"atlas/allen-ccf-2017/regions.json","role":"atlas-geometry","sha256":"aa5615bdf76493a815ad20bd77441998415b13272bc58101cd8da674848ed3ad"},{"commit":"1d908bea095be2616a750d939d143f3b4db2a641","description":"Pinned curated top SVG fragment","license":"MIT; repository-file=LICENSES/IBL-EPHYS-ATLAS-V1-STATIC-ASSETS-MIT.txt;sha256=f31adf14af0265cae0f866a515bda9b0750f7473d40cef5598c7f4305037ce37","path":"legacy/slices_top.json","repository":"int-brain-lab/ephys-atlas-web","role":"atlas-geometry","sha256":"4dc788df3da667c8dde5a9f1b0abc258715a916cb8609542bdd849f793815c30"},{"commit":"1d908bea095be2616a750d939d143f3b4db2a641","description":"Pinned curated swanson SVG fragment","license":"MIT; repository-file=LICENSES/IBL-EPHYS-ATLAS-V1-STATIC-ASSETS-MIT.txt;sha256=f31adf14af0265cae0f866a515bda9b0750f7473d40cef5598c7f4305037ce37","path":"legacy/slices_swanson.json","repository":"int-brain-lab/ephys-atlas-web","role":"atlas-geometry","sha256":"347ad18c2eb0fad1012d30432ff4abf8a09dc0acc0f33b57efbdd2790826acba"}]},"reference_space_id":"allen-ccf-2017","schema_version":"1.0"}